
*** Running vivado
    with args -log system_wrapper.vdi -applog -m64 -product Vivado -messageDb vivado.pb -mode batch -source system_wrapper.tcl -notrace



****** Vivado v2024.2 (64-bit)
  **** SW Build 5239630 on Fri Nov 08 22:35:27 MST 2024
  **** IP Build 5239520 on Sun Nov 10 16:12:51 MST 2024
  **** SharedData Build 5239561 on Fri Nov 08 14:39:27 MST 2024
  **** Start of session at: Sun Feb 15 20:17:22 2026
    ** Copyright 1986-2022 Xilinx, Inc. All Rights Reserved.
    ** Copyright 2022-2024 Advanced Micro Devices, Inc. All Rights Reserved.

source system_wrapper.tcl -notrace
INFO: [IP_Flow 19-234] Refreshing IP repositories
INFO: [IP_Flow 19-1700] Loaded user IP repository 'e:/FPGA/2024/MicroPhase-Z7-Lite-Board/BGN/edt_zc702_workspace/bgn_ip/bgn_ip/hls/impl'.
INFO: [IP_Flow 19-2313] Loaded Vivado IP repository 'D:/Xilinx/Vivado/2024.2/data/ip'.
Command: link_design -top system_wrapper -part xc7z020clg400-2
Design is defaulting to srcset: sources_1
Design is defaulting to constrset: constrs_1
INFO: [Device 21-403] Loading part xc7z020clg400-2
Netlist sorting complete. Time (s): cpu = 00:00:00 ; elapsed = 00:00:00.117 . Memory (MB): peak = 735.906 ; gain = 0.000
INFO: [Netlist 29-17] Analyzing 498 Unisim elements for replacement
INFO: [Netlist 29-28] Unisim Transformation completed in 0 CPU seconds
INFO: [Project 1-479] Netlist was created with Vivado 2024.2
INFO: [Project 1-570] Preparing netlist for logic optimization
Parsing XDC File [e:/FPGA/2024/MicroPhase-Z7-Lite-Board/BGN/edt_zc702/edt_zc702.gen/sources_1/bd/system/ip/system_processing_system7_0_1/system_processing_system7_0_1.xdc] for cell 'system_i/processing_system7_0/inst'
Finished Parsing XDC File [e:/FPGA/2024/MicroPhase-Z7-Lite-Board/BGN/edt_zc702/edt_zc702.gen/sources_1/bd/system/ip/system_processing_system7_0_1/system_processing_system7_0_1.xdc] for cell 'system_i/processing_system7_0/inst'
Parsing XDC File [e:/FPGA/2024/MicroPhase-Z7-Lite-Board/BGN/edt_zc702/edt_zc702.gen/sources_1/bd/system/ip/system_axi_smc_0/bd_0/ip/ip_1/bd_44e3_psr_aclk_0_board.xdc] for cell 'system_i/axi_smc/inst/clk_map/psr_aclk/U0'
Finished Parsing XDC File [e:/FPGA/2024/MicroPhase-Z7-Lite-Board/BGN/edt_zc702/edt_zc702.gen/sources_1/bd/system/ip/system_axi_smc_0/bd_0/ip/ip_1/bd_44e3_psr_aclk_0_board.xdc] for cell 'system_i/axi_smc/inst/clk_map/psr_aclk/U0'
Parsing XDC File [e:/FPGA/2024/MicroPhase-Z7-Lite-Board/BGN/edt_zc702/edt_zc702.gen/sources_1/bd/system/ip/system_axi_smc_0/bd_0/ip/ip_1/bd_44e3_psr_aclk_0.xdc] for cell 'system_i/axi_smc/inst/clk_map/psr_aclk/U0'
Finished Parsing XDC File [e:/FPGA/2024/MicroPhase-Z7-Lite-Board/BGN/edt_zc702/edt_zc702.gen/sources_1/bd/system/ip/system_axi_smc_0/bd_0/ip/ip_1/bd_44e3_psr_aclk_0.xdc] for cell 'system_i/axi_smc/inst/clk_map/psr_aclk/U0'
Parsing XDC File [e:/FPGA/2024/MicroPhase-Z7-Lite-Board/BGN/edt_zc702/edt_zc702.gen/sources_1/bd/system/ip/system_axi_smc_0/smartconnect.xdc] for cell 'system_i/axi_smc/inst'
Finished Parsing XDC File [e:/FPGA/2024/MicroPhase-Z7-Lite-Board/BGN/edt_zc702/edt_zc702.gen/sources_1/bd/system/ip/system_axi_smc_0/smartconnect.xdc] for cell 'system_i/axi_smc/inst'
Parsing XDC File [e:/FPGA/2024/MicroPhase-Z7-Lite-Board/BGN/edt_zc702/edt_zc702.gen/sources_1/bd/system/ip/system_rst_ps7_0_100M_0/system_rst_ps7_0_100M_0_board.xdc] for cell 'system_i/rst_ps7_0_100M/U0'
Finished Parsing XDC File [e:/FPGA/2024/MicroPhase-Z7-Lite-Board/BGN/edt_zc702/edt_zc702.gen/sources_1/bd/system/ip/system_rst_ps7_0_100M_0/system_rst_ps7_0_100M_0_board.xdc] for cell 'system_i/rst_ps7_0_100M/U0'
Parsing XDC File [e:/FPGA/2024/MicroPhase-Z7-Lite-Board/BGN/edt_zc702/edt_zc702.gen/sources_1/bd/system/ip/system_rst_ps7_0_100M_0/system_rst_ps7_0_100M_0.xdc] for cell 'system_i/rst_ps7_0_100M/U0'
WARNING: [Vivado_Tcl 4-921] Waiver ID 'CDC-11' -to list should not be empty. [e:/FPGA/2024/MicroPhase-Z7-Lite-Board/BGN/edt_zc702/edt_zc702.gen/sources_1/bd/system/ip/system_rst_ps7_0_100M_0/system_rst_ps7_0_100M_0.xdc:50]
Finished Parsing XDC File [e:/FPGA/2024/MicroPhase-Z7-Lite-Board/BGN/edt_zc702/edt_zc702.gen/sources_1/bd/system/ip/system_rst_ps7_0_100M_0/system_rst_ps7_0_100M_0.xdc] for cell 'system_i/rst_ps7_0_100M/U0'
INFO: [Project 1-1714] 14 XPM XDC files have been applied to the design.
INFO: [Opt 31-138] Pushed 0 inverter(s) to 0 load pin(s).
INFO: [Project 1-1687] 1 scoped IP constraints or related sub-commands were skipped due to synthesis logic optimizations usually triggered by constant connectivity or unconnected output pins. To review the skipped constraints and messages, run the command 'set_param netlist.IPMsgFiltering false' before opening the design.
Netlist sorting complete. Time (s): cpu = 00:00:00 ; elapsed = 00:00:00.002 . Memory (MB): peak = 903.875 ; gain = 0.000
INFO: [Project 1-111] Unisim Transformation Summary:
  A total of 32 instances were transformed.
  RAM128X1S => RAM128X1S (MUXF7, RAMS64E(x2)): 32 instances

12 Infos, 1 Warnings, 0 Critical Warnings and 0 Errors encountered.
link_design completed successfully
Command: opt_design
Attempting to get a license for feature 'Implementation' and/or device 'xc7z020'
INFO: [Common 17-349] Got license for feature 'Implementation' and/or device 'xc7z020'
Running DRC as a precondition to command opt_design

Starting DRC Task
INFO: [DRC 23-27] Running DRC with 2 threads
INFO: [Project 1-461] DRC finished with 0 Errors
INFO: [Project 1-462] Please refer to the DRC report (report_drc) for more information.

Time (s): cpu = 00:00:01 ; elapsed = 00:00:00.575 . Memory (MB): peak = 937.449 ; gain = 33.574

Starting Cache Timing Information Task
INFO: [Timing 38-35] Done setting XDC timing constraints.
Ending Cache Timing Information Task | Checksum: 1837d5127

Time (s): cpu = 00:00:03 ; elapsed = 00:00:04 . Memory (MB): peak = 1453.484 ; gain = 516.035

Starting Logic Optimization Task

Phase 1 Initialization

Phase 1.1 Core Generation And Design Setup
Phase 1.1 Core Generation And Design Setup | Checksum: 1837d5127

Time (s): cpu = 00:00:00 ; elapsed = 00:00:00.008 . Memory (MB): peak = 1864.785 ; gain = 0.000

Phase 1.2 Setup Constraints And Sort Netlist
Phase 1.2 Setup Constraints And Sort Netlist | Checksum: 1837d5127

Time (s): cpu = 00:00:00 ; elapsed = 00:00:00.012 . Memory (MB): peak = 1864.785 ; gain = 0.000
Phase 1 Initialization | Checksum: 1837d5127

Time (s): cpu = 00:00:00 ; elapsed = 00:00:00.014 . Memory (MB): peak = 1864.785 ; gain = 0.000

Phase 2 Timer Update And Timing Data Collection

Phase 2.1 Timer Update
Phase 2.1 Timer Update | Checksum: 1837d5127

Time (s): cpu = 00:00:00 ; elapsed = 00:00:00.085 . Memory (MB): peak = 1864.785 ; gain = 0.000

Phase 2.2 Timing Data Collection
Phase 2.2 Timing Data Collection | Checksum: 1837d5127

Time (s): cpu = 00:00:00 ; elapsed = 00:00:00.097 . Memory (MB): peak = 1864.785 ; gain = 0.000
Phase 2 Timer Update And Timing Data Collection | Checksum: 1837d5127

Time (s): cpu = 00:00:00 ; elapsed = 00:00:00.098 . Memory (MB): peak = 1864.785 ; gain = 0.000

Phase 3 Retarget
INFO: [Opt 31-1851] Number of loadless carry chains removed were: 0
INFO: [Opt 31-1834] Total Chains To Be Transformed Were: 0 AND Number of Transformed insts Created are: 0
INFO: [Opt 31-138] Pushed 12 inverter(s) to 45 load pin(s).
INFO: [Opt 31-49] Retargeted 0 cell(s).
Phase 3 Retarget | Checksum: 236c43f73

Time (s): cpu = 00:00:00 ; elapsed = 00:00:00.167 . Memory (MB): peak = 1864.785 ; gain = 0.000
Retarget | Checksum: 236c43f73
INFO: [Opt 31-389] Phase Retarget created 52 cells and removed 91 cells
INFO: [Opt 31-1021] In phase Retarget, 20 netlist objects are constrained preventing optimization. Please run opt_design with -debug_log to get more detail. 

Phase 4 Constant propagation
INFO: [Opt 31-138] Pushed 0 inverter(s) to 0 load pin(s).
Phase 4 Constant propagation | Checksum: 1e80d9f6f

Time (s): cpu = 00:00:00 ; elapsed = 00:00:00.199 . Memory (MB): peak = 1864.785 ; gain = 0.000
Constant propagation | Checksum: 1e80d9f6f
INFO: [Opt 31-389] Phase Constant propagation created 62 cells and removed 110 cells
INFO: [Opt 31-1021] In phase Constant propagation, 20 netlist objects are constrained preventing optimization. Please run opt_design with -debug_log to get more detail. 

Phase 5 Sweep
INFO: [Constraints 18-11670] Building netlist checker database with flags, 0x8
Done building netlist checker database: Time (s): cpu = 00:00:00 ; elapsed = 00:00:00.003 . Memory (MB): peak = 1864.785 ; gain = 0.000
INFO: [Constraints 18-11670] Building netlist checker database with flags, 0x8
Done building netlist checker database: Time (s): cpu = 00:00:00 ; elapsed = 00:00:00.002 . Memory (MB): peak = 1864.785 ; gain = 0.000
Phase 5 Sweep | Checksum: 168fea1c0

Time (s): cpu = 00:00:01 ; elapsed = 00:00:00.392 . Memory (MB): peak = 1864.785 ; gain = 0.000
Sweep | Checksum: 168fea1c0
INFO: [Opt 31-389] Phase Sweep created 0 cells and removed 85 cells
INFO: [Opt 31-1021] In phase Sweep, 25 netlist objects are constrained preventing optimization. Please run opt_design with -debug_log to get more detail. 

Phase 6 BUFG optimization
Phase 6 BUFG optimization | Checksum: 168fea1c0

Time (s): cpu = 00:00:01 ; elapsed = 00:00:00.439 . Memory (MB): peak = 1864.785 ; gain = 0.000
BUFG optimization | Checksum: 168fea1c0
INFO: [Opt 31-662] Phase BUFG optimization created 0 cells of which 0 are BUFGs and removed 0 cells.

Phase 7 Shift Register Optimization
INFO: [Opt 31-1064] SRL Remap converted 0 SRLs to 0 registers and converted 0 registers of register chains to 0 SRLs
Phase 7 Shift Register Optimization | Checksum: 168fea1c0

Time (s): cpu = 00:00:01 ; elapsed = 00:00:00.447 . Memory (MB): peak = 1864.785 ; gain = 0.000
Shift Register Optimization | Checksum: 168fea1c0
INFO: [Opt 31-389] Phase Shift Register Optimization created 0 cells and removed 0 cells

Phase 8 Post Processing Netlist
Phase 8 Post Processing Netlist | Checksum: 168fea1c0

Time (s): cpu = 00:00:01 ; elapsed = 00:00:00.461 . Memory (MB): peak = 1864.785 ; gain = 0.000
Post Processing Netlist | Checksum: 168fea1c0
INFO: [Opt 31-389] Phase Post Processing Netlist created 0 cells and removed 0 cells
INFO: [Opt 31-1021] In phase Post Processing Netlist, 20 netlist objects are constrained preventing optimization. Please run opt_design with -debug_log to get more detail. 

Phase 9 Finalization

Phase 9.1 Finalizing Design Cores and Updating Shapes
Phase 9.1 Finalizing Design Cores and Updating Shapes | Checksum: 18b874b33

Time (s): cpu = 00:00:01 ; elapsed = 00:00:00.576 . Memory (MB): peak = 1864.785 ; gain = 0.000

Phase 9.2 Verifying Netlist Connectivity

Starting Connectivity Check Task

Time (s): cpu = 00:00:00 ; elapsed = 00:00:00.009 . Memory (MB): peak = 1864.785 ; gain = 0.000
Phase 9.2 Verifying Netlist Connectivity | Checksum: 18b874b33

Time (s): cpu = 00:00:01 ; elapsed = 00:00:00.586 . Memory (MB): peak = 1864.785 ; gain = 0.000
Phase 9 Finalization | Checksum: 18b874b33

Time (s): cpu = 00:00:01 ; elapsed = 00:00:00.588 . Memory (MB): peak = 1864.785 ; gain = 0.000
Opt_design Change Summary
=========================


-------------------------------------------------------------------------------------------------------------------------
|  Phase                        |  #Cells created  |  #Cells Removed  |  #Constrained objects preventing optimizations  |
-------------------------------------------------------------------------------------------------------------------------
|  Retarget                     |              52  |              91  |                                             20  |
|  Constant propagation         |              62  |             110  |                                             20  |
|  Sweep                        |               0  |              85  |                                             25  |
|  BUFG optimization            |               0  |               0  |                                              0  |
|  Shift Register Optimization  |               0  |               0  |                                              0  |
|  Post Processing Netlist      |               0  |               0  |                                             20  |
-------------------------------------------------------------------------------------------------------------------------


Ending Logic Optimization Task | Checksum: 18b874b33

Time (s): cpu = 00:00:01 ; elapsed = 00:00:00.590 . Memory (MB): peak = 1864.785 ; gain = 0.000

Starting Power Optimization Task
INFO: [Pwropt 34-132] Skipping clock gating for clocks with a period < 2.00 ns.
INFO: [Timing 38-35] Done setting XDC timing constraints.
Running Vector-less Activity Propagation...

Finished Running Vector-less Activity Propagation
INFO: [Pwropt 34-9] Applying IDT optimizations ...
INFO: [Pwropt 34-10] Applying ODC optimizations ...


Starting PowerOpt Patch Enables Task
INFO: [Pwropt 34-162] WRITE_MODE attribute of 0 BRAM(s) out of a total of 53 has been updated to save power. Run report_power_opt to get a complete listing of the BRAMs updated.
INFO: [Pwropt 34-201] Structural ODC has moved 0 WE to EN ports
Number of BRAM Ports augmented: 0 newly gated: 2 Total Ports: 106
Ending PowerOpt Patch Enables Task | Checksum: 195248667

Time (s): cpu = 00:00:00 ; elapsed = 00:00:00.098 . Memory (MB): peak = 1996.203 ; gain = 0.000
Ending Power Optimization Task | Checksum: 195248667

Time (s): cpu = 00:00:03 ; elapsed = 00:00:02 . Memory (MB): peak = 1996.203 ; gain = 131.418

Starting Final Cleanup Task
Ending Final Cleanup Task | Checksum: 195248667

Time (s): cpu = 00:00:00 ; elapsed = 00:00:00.002 . Memory (MB): peak = 1996.203 ; gain = 0.000

Starting Netlist Obfuscation Task
Netlist sorting complete. Time (s): cpu = 00:00:00 ; elapsed = 00:00:00.004 . Memory (MB): peak = 1996.203 ; gain = 0.000
Ending Netlist Obfuscation Task | Checksum: 1740f311a

Time (s): cpu = 00:00:00 ; elapsed = 00:00:00.005 . Memory (MB): peak = 1996.203 ; gain = 0.000
INFO: [Common 17-83] Releasing license: Implementation
42 Infos, 1 Warnings, 0 Critical Warnings and 0 Errors encountered.
opt_design completed successfully
opt_design: Time (s): cpu = 00:00:10 ; elapsed = 00:00:10 . Memory (MB): peak = 1996.203 ; gain = 1092.328
INFO: [Vivado 12-24828] Executing command : report_drc -file system_wrapper_drc_opted.rpt -pb system_wrapper_drc_opted.pb -rpx system_wrapper_drc_opted.rpx
Command: report_drc -file system_wrapper_drc_opted.rpt -pb system_wrapper_drc_opted.pb -rpx system_wrapper_drc_opted.rpx
INFO: [IP_Flow 19-1839] IP Catalog is up to date.
INFO: [DRC 23-27] Running DRC with 2 threads
INFO: [Vivado_Tcl 2-168] The results of DRC are in file E:/FPGA/2024/MicroPhase-Z7-Lite-Board/BGN/edt_zc702/edt_zc702.runs/impl_1/system_wrapper_drc_opted.rpt.
report_drc completed successfully
INFO: [Timing 38-480] Writing timing data to binary archive.
Wrote PlaceDB: Time (s): cpu = 00:00:00 ; elapsed = 00:00:00.009 . Memory (MB): peak = 1996.203 ; gain = 0.000
Write ShapeDB Complete: Time (s): cpu = 00:00:00 ; elapsed = 00:00:00.011 . Memory (MB): peak = 1996.203 ; gain = 0.000
Wrote PulsedLatchDB: Time (s): cpu = 00:00:00 ; elapsed = 00:00:00 . Memory (MB): peak = 1996.203 ; gain = 0.000
Writing XDEF routing.
Writing XDEF routing logical nets.
Writing XDEF routing special nets.
Wrote RouteStorage: Time (s): cpu = 00:00:00 ; elapsed = 00:00:00.019 . Memory (MB): peak = 1996.203 ; gain = 0.000
Wrote Netlist Cache: Time (s): cpu = 00:00:00 ; elapsed = 00:00:00 . Memory (MB): peak = 1996.203 ; gain = 0.000
Wrote Device Cache: Time (s): cpu = 00:00:00 ; elapsed = 00:00:00.006 . Memory (MB): peak = 1996.203 ; gain = 0.000
Write Physdb Complete: Time (s): cpu = 00:00:00 ; elapsed = 00:00:00.038 . Memory (MB): peak = 1996.203 ; gain = 0.000
INFO: [Common 17-1381] The checkpoint 'E:/FPGA/2024/MicroPhase-Z7-Lite-Board/BGN/edt_zc702/edt_zc702.runs/impl_1/system_wrapper_opt.dcp' has been generated.
Command: place_design
Attempting to get a license for feature 'Implementation' and/or device 'xc7z020'
INFO: [Common 17-349] Got license for feature 'Implementation' and/or device 'xc7z020'
INFO: [Common 17-83] Releasing license: Implementation
INFO: [DRC 23-27] Running DRC with 2 threads
INFO: [Vivado_Tcl 4-198] DRC finished with 0 Errors
INFO: [Vivado_Tcl 4-199] Please refer to the DRC report (report_drc) for more information.
Running DRC as a precondition to command place_design
INFO: [DRC 23-27] Running DRC with 2 threads
INFO: [Vivado_Tcl 4-198] DRC finished with 0 Errors, 2 Advisories
INFO: [Vivado_Tcl 4-199] Please refer to the DRC report (report_drc) for more information.
INFO: [Place 30-611] Multithreading enabled for place_design using a maximum of 2 CPUs

Starting Placer Task

Phase 1 Placer Initialization

Phase 1.1 Placer Initialization Netlist Sorting
Netlist sorting complete. Time (s): cpu = 00:00:00 ; elapsed = 00:00:00.002 . Memory (MB): peak = 1996.203 ; gain = 0.000
Phase 1.1 Placer Initialization Netlist Sorting | Checksum: aef80d17

Time (s): cpu = 00:00:00 ; elapsed = 00:00:00.008 . Memory (MB): peak = 1996.203 ; gain = 0.000
Netlist sorting complete. Time (s): cpu = 00:00:00 ; elapsed = 00:00:00.002 . Memory (MB): peak = 1996.203 ; gain = 0.000

Phase 1.2 IO Placement/ Clock Placement/ Build Placer Device
INFO: [Timing 38-35] Done setting XDC timing constraints.
Phase 1.2 IO Placement/ Clock Placement/ Build Placer Device | Checksum: 75b39895

Time (s): cpu = 00:00:01 ; elapsed = 00:00:00.541 . Memory (MB): peak = 1996.203 ; gain = 0.000

Phase 1.3 Build Placer Netlist Model
Phase 1.3 Build Placer Netlist Model | Checksum: 16e40966b

Time (s): cpu = 00:00:02 ; elapsed = 00:00:01 . Memory (MB): peak = 1996.203 ; gain = 0.000

Phase 1.4 Constrain Clocks/Macros
Phase 1.4 Constrain Clocks/Macros | Checksum: 16e40966b

Time (s): cpu = 00:00:02 ; elapsed = 00:00:01 . Memory (MB): peak = 1996.203 ; gain = 0.000
Phase 1 Placer Initialization | Checksum: 16e40966b

Time (s): cpu = 00:00:02 ; elapsed = 00:00:01 . Memory (MB): peak = 1996.203 ; gain = 0.000

Phase 2 Global Placement

Phase 2.1 Floorplanning
Phase 2.1 Floorplanning | Checksum: 111f9edd9

Time (s): cpu = 00:00:02 ; elapsed = 00:00:01 . Memory (MB): peak = 1996.203 ; gain = 0.000

Phase 2.2 Update Timing before SLR Path Opt
Phase 2.2 Update Timing before SLR Path Opt | Checksum: 13672e7d8

Time (s): cpu = 00:00:02 ; elapsed = 00:00:01 . Memory (MB): peak = 1996.203 ; gain = 0.000

Phase 2.3 Post-Processing in Floorplanning
Phase 2.3 Post-Processing in Floorplanning | Checksum: 13672e7d8

Time (s): cpu = 00:00:02 ; elapsed = 00:00:01 . Memory (MB): peak = 1996.203 ; gain = 0.000

Phase 2.4 Global Place Phase1
Phase 2.4 Global Place Phase1 | Checksum: 1a73cff2b

Time (s): cpu = 00:00:05 ; elapsed = 00:00:03 . Memory (MB): peak = 1996.203 ; gain = 0.000

Phase 2.5 Global Place Phase2

Phase 2.5.1 UpdateTiming Before Physical Synthesis
Phase 2.5.1 UpdateTiming Before Physical Synthesis | Checksum: 1b70b4286

Time (s): cpu = 00:00:05 ; elapsed = 00:00:03 . Memory (MB): peak = 1996.203 ; gain = 0.000

Phase 2.5.2 Physical Synthesis In Placer
INFO: [Physopt 32-1035] Found 0 LUTNM shape to break, 305 LUT instances to create LUTNM shape
INFO: [Physopt 32-1044] Break lutnm for timing: one critical 0, two critical 0, total 0, new lutff created 0
INFO: [Physopt 32-1138] End 1 Pass. Optimized 136 nets or LUTs. Breaked 0 LUT, combined 136 existing LUTs and moved 0 existing LUT
INFO: [Physopt 32-65] No nets found for high-fanout optimization.
INFO: [Physopt 32-232] Optimized 0 net. Created 0 new instance.
INFO: [Physopt 32-775] End 1 Pass. Optimized 0 net or cell. Created 0 new cell, deleted 0 existing cell and moved 0 existing cell
INFO: [Physopt 32-670] No setup violation found.  DSP Register Optimization was not performed.
INFO: [Physopt 32-670] No setup violation found.  Shift Register to Pipeline Optimization was not performed.
INFO: [Physopt 32-670] No setup violation found.  Shift Register Optimization was not performed.
INFO: [Physopt 32-670] No setup violation found.  BRAM Register Optimization was not performed.
INFO: [Physopt 32-670] No setup violation found.  URAM Register Optimization was not performed.
INFO: [Physopt 32-949] No candidate nets found for dynamic/static region interface net replication
INFO: [Physopt 32-775] End 1 Pass. Optimized 0 net or cell. Created 0 new cell, deleted 0 existing cell and moved 0 existing cell
Netlist sorting complete. Time (s): cpu = 00:00:00 ; elapsed = 00:00:00.002 . Memory (MB): peak = 1996.203 ; gain = 0.000

Summary of Physical Synthesis Optimizations
============================================


-----------------------------------------------------------------------------------------------------------------------------------------------------------
|  Optimization                                     |  Added Cells  |  Removed Cells  |  Optimized Cells/Nets  |  Dont Touch  |  Iterations  |  Elapsed   |
-----------------------------------------------------------------------------------------------------------------------------------------------------------
|  LUT Combining                                    |            0  |            136  |                   136  |           0  |           1  |  00:00:00  |
|  Retime                                           |            0  |              0  |                     0  |           0  |           1  |  00:00:00  |
|  Very High Fanout                                 |            0  |              0  |                     0  |           0  |           1  |  00:00:00  |
|  DSP Register                                     |            0  |              0  |                     0  |           0  |           0  |  00:00:00  |
|  Shift Register to Pipeline                       |            0  |              0  |                     0  |           0  |           0  |  00:00:00  |
|  Shift Register                                   |            0  |              0  |                     0  |           0  |           0  |  00:00:00  |
|  BRAM Register                                    |            0  |              0  |                     0  |           0  |           0  |  00:00:00  |
|  URAM Register                                    |            0  |              0  |                     0  |           0  |           0  |  00:00:00  |
|  Dynamic/Static Region Interface Net Replication  |            0  |              0  |                     0  |           0  |           1  |  00:00:00  |
|  Total                                            |            0  |            136  |                   136  |           0  |           4  |  00:00:00  |
-----------------------------------------------------------------------------------------------------------------------------------------------------------


Phase 2.5.2 Physical Synthesis In Placer | Checksum: 17bade730

Time (s): cpu = 00:00:06 ; elapsed = 00:00:04 . Memory (MB): peak = 1996.203 ; gain = 0.000
Phase 2.5 Global Place Phase2 | Checksum: 18d46fc50

Time (s): cpu = 00:00:06 ; elapsed = 00:00:04 . Memory (MB): peak = 1996.203 ; gain = 0.000
Phase 2 Global Placement | Checksum: 18d46fc50

Time (s): cpu = 00:00:06 ; elapsed = 00:00:04 . Memory (MB): peak = 1996.203 ; gain = 0.000

Phase 3 Detail Placement

Phase 3.1 Commit Multi Column Macros
Phase 3.1 Commit Multi Column Macros | Checksum: 1ae9c479f

Time (s): cpu = 00:00:06 ; elapsed = 00:00:04 . Memory (MB): peak = 1996.203 ; gain = 0.000

Phase 3.2 Commit Most Macros & LUTRAMs
Phase 3.2 Commit Most Macros & LUTRAMs | Checksum: eed76ed3

Time (s): cpu = 00:00:07 ; elapsed = 00:00:04 . Memory (MB): peak = 1996.203 ; gain = 0.000

Phase 3.3 Area Swap Optimization
Phase 3.3 Area Swap Optimization | Checksum: e0013d75

Time (s): cpu = 00:00:07 ; elapsed = 00:00:04 . Memory (MB): peak = 1996.203 ; gain = 0.000

Phase 3.4 Pipeline Register Optimization
Phase 3.4 Pipeline Register Optimization | Checksum: ca5ee948

Time (s): cpu = 00:00:07 ; elapsed = 00:00:04 . Memory (MB): peak = 1996.203 ; gain = 0.000

Phase 3.5 Small Shape Detail Placement
Phase 3.5 Small Shape Detail Placement | Checksum: 1972f8113

Time (s): cpu = 00:00:07 ; elapsed = 00:00:05 . Memory (MB): peak = 1996.203 ; gain = 0.000

Phase 3.6 Re-assign LUT pins
Phase 3.6 Re-assign LUT pins | Checksum: 18b00ca90

Time (s): cpu = 00:00:07 ; elapsed = 00:00:05 . Memory (MB): peak = 1996.203 ; gain = 0.000

Phase 3.7 Pipeline Register Optimization
Phase 3.7 Pipeline Register Optimization | Checksum: 18d1726e5

Time (s): cpu = 00:00:08 ; elapsed = 00:00:05 . Memory (MB): peak = 1996.203 ; gain = 0.000
Phase 3 Detail Placement | Checksum: 18d1726e5

Time (s): cpu = 00:00:08 ; elapsed = 00:00:05 . Memory (MB): peak = 1996.203 ; gain = 0.000

Phase 4 Post Placement Optimization and Clean-Up

Phase 4.1 Post Commit Optimization
INFO: [Timing 38-35] Done setting XDC timing constraints.

Phase 4.1.1 Post Placement Optimization
Post Placement Optimization Initialization | Checksum: 25458bb6b

Phase 4.1.1.1 BUFG Insertion

Starting Physical Synthesis Task

Phase 1 Physical Synthesis Initialization
INFO: [Physopt 32-721] Multithreading enabled for phys_opt_design using a maximum of 2 CPUs
INFO: [Physopt 32-619] Estimated Timing Summary | WNS=3.032 | TNS=0.000 |
Phase 1 Physical Synthesis Initialization | Checksum: 26201e234

Time (s): cpu = 00:00:00 ; elapsed = 00:00:00.122 . Memory (MB): peak = 1996.203 ; gain = 0.000
INFO: [Place 46-56] BUFG insertion identified 0 candidate nets. Inserted BUFG: 0, Replicated BUFG Driver: 0, Skipped due to Placement/Routing Conflicts: 0, Skipped due to Timing Degradation: 0, Skipped due to netlist editing failed: 0.
Ending Physical Synthesis Task | Checksum: 2316a59a6

Time (s): cpu = 00:00:00 ; elapsed = 00:00:00.141 . Memory (MB): peak = 1996.203 ; gain = 0.000
Phase 4.1.1.1 BUFG Insertion | Checksum: 25458bb6b

Time (s): cpu = 00:00:09 ; elapsed = 00:00:06 . Memory (MB): peak = 1996.203 ; gain = 0.000

Phase 4.1.1.2 Post Placement Timing Optimization
INFO: [Place 30-746] Post Placement Timing Summary WNS=3.032. For the most accurate timing information please run report_timing.
Phase 4.1.1.2 Post Placement Timing Optimization | Checksum: 250c6822f

Time (s): cpu = 00:00:09 ; elapsed = 00:00:06 . Memory (MB): peak = 1996.203 ; gain = 0.000

Time (s): cpu = 00:00:09 ; elapsed = 00:00:06 . Memory (MB): peak = 1996.203 ; gain = 0.000
Phase 4.1 Post Commit Optimization | Checksum: 250c6822f

Time (s): cpu = 00:00:09 ; elapsed = 00:00:06 . Memory (MB): peak = 1996.203 ; gain = 0.000

Phase 4.2 Post Placement Cleanup
Phase 4.2 Post Placement Cleanup | Checksum: 250c6822f

Time (s): cpu = 00:00:09 ; elapsed = 00:00:06 . Memory (MB): peak = 1996.203 ; gain = 0.000

Phase 4.3 Placer Reporting

Phase 4.3.1 Print Estimated Congestion
INFO: [Place 30-612] Post-Placement Estimated Congestion 
 ____________________________________________________
|           | Global Congestion | Short Congestion  |
| Direction | Region Size       | Region Size       |
|___________|___________________|___________________|
|      North|                1x1|                1x1|
|___________|___________________|___________________|
|      South|                1x1|                1x1|
|___________|___________________|___________________|
|       East|                1x1|                1x1|
|___________|___________________|___________________|
|       West|                1x1|                1x1|
|___________|___________________|___________________|

Phase 4.3.1 Print Estimated Congestion | Checksum: 250c6822f

Time (s): cpu = 00:00:09 ; elapsed = 00:00:06 . Memory (MB): peak = 1996.203 ; gain = 0.000
Phase 4.3 Placer Reporting | Checksum: 250c6822f

Time (s): cpu = 00:00:09 ; elapsed = 00:00:06 . Memory (MB): peak = 1996.203 ; gain = 0.000

Phase 4.4 Final Placement Cleanup
Netlist sorting complete. Time (s): cpu = 00:00:00 ; elapsed = 00:00:00.002 . Memory (MB): peak = 1996.203 ; gain = 0.000

Time (s): cpu = 00:00:09 ; elapsed = 00:00:06 . Memory (MB): peak = 1996.203 ; gain = 0.000
Phase 4 Post Placement Optimization and Clean-Up | Checksum: 1cd09588d

Time (s): cpu = 00:00:09 ; elapsed = 00:00:06 . Memory (MB): peak = 1996.203 ; gain = 0.000
Ending Placer Task | Checksum: e8960c01

Time (s): cpu = 00:00:09 ; elapsed = 00:00:06 . Memory (MB): peak = 1996.203 ; gain = 0.000
77 Infos, 1 Warnings, 0 Critical Warnings and 0 Errors encountered.
place_design completed successfully
place_design: Time (s): cpu = 00:00:11 ; elapsed = 00:00:07 . Memory (MB): peak = 1996.203 ; gain = 0.000
INFO: [Vivado 12-24838] Running report commands "report_control_sets, report_io, report_utilization" in parallel.
Running report generation with 2 threads.
INFO: [Vivado 12-24828] Executing command : report_utilization -file system_wrapper_utilization_placed.rpt -pb system_wrapper_utilization_placed.pb
INFO: [Vivado 12-24828] Executing command : report_io -file system_wrapper_io_placed.rpt
report_io: Time (s): cpu = 00:00:00 ; elapsed = 00:00:00.041 . Memory (MB): peak = 1996.203 ; gain = 0.000
INFO: [Vivado 12-24828] Executing command : report_control_sets -verbose -file system_wrapper_control_sets_placed.rpt
report_control_sets: Time (s): cpu = 00:00:00 ; elapsed = 00:00:00.008 . Memory (MB): peak = 1996.203 ; gain = 0.000
INFO: [Timing 38-480] Writing timing data to binary archive.
Write ShapeDB Complete: Time (s): cpu = 00:00:00 ; elapsed = 00:00:00.013 . Memory (MB): peak = 1996.203 ; gain = 0.000
Wrote PlaceDB: Time (s): cpu = 00:00:01 ; elapsed = 00:00:00.250 . Memory (MB): peak = 1996.203 ; gain = 0.000
Wrote PulsedLatchDB: Time (s): cpu = 00:00:00 ; elapsed = 00:00:00 . Memory (MB): peak = 1996.203 ; gain = 0.000
Writing XDEF routing.
Writing XDEF routing logical nets.
Writing XDEF routing special nets.
Wrote RouteStorage: Time (s): cpu = 00:00:00 ; elapsed = 00:00:00.019 . Memory (MB): peak = 1996.203 ; gain = 0.000
Wrote Netlist Cache: Time (s): cpu = 00:00:00 ; elapsed = 00:00:00.004 . Memory (MB): peak = 1996.203 ; gain = 0.000
Wrote Device Cache: Time (s): cpu = 00:00:00 ; elapsed = 00:00:00.006 . Memory (MB): peak = 1996.203 ; gain = 0.000
Write Physdb Complete: Time (s): cpu = 00:00:01 ; elapsed = 00:00:00.285 . Memory (MB): peak = 1996.203 ; gain = 0.000
INFO: [Common 17-1381] The checkpoint 'E:/FPGA/2024/MicroPhase-Z7-Lite-Board/BGN/edt_zc702/edt_zc702.runs/impl_1/system_wrapper_placed.dcp' has been generated.
Command: phys_opt_design
Attempting to get a license for feature 'Implementation' and/or device 'xc7z020'
INFO: [Common 17-349] Got license for feature 'Implementation' and/or device 'xc7z020'

Starting Initial Update Timing Task

Time (s): cpu = 00:00:00 ; elapsed = 00:00:00.416 . Memory (MB): peak = 1996.203 ; gain = 0.000
INFO: [Vivado_Tcl 4-2279] Estimated Timing Summary | WNS= 3.032 | TNS= 0.000 | 
INFO: [Vivado_Tcl 4-383] Design worst setup slack (WNS) is greater than or equal to 0.000 ns. All physical synthesis setup optimizations will be skipped.
INFO: [Vivado_Tcl 4-232] No setup violation found. The netlist was not modified.
INFO: [Common 17-83] Releasing license: Implementation
88 Infos, 1 Warnings, 0 Critical Warnings and 0 Errors encountered.
phys_opt_design completed successfully
INFO: [Timing 38-480] Writing timing data to binary archive.
Write ShapeDB Complete: Time (s): cpu = 00:00:00 ; elapsed = 00:00:00.014 . Memory (MB): peak = 1996.203 ; gain = 0.000
Wrote PlaceDB: Time (s): cpu = 00:00:01 ; elapsed = 00:00:00.248 . Memory (MB): peak = 1996.203 ; gain = 0.000
Wrote PulsedLatchDB: Time (s): cpu = 00:00:00 ; elapsed = 00:00:00 . Memory (MB): peak = 1996.203 ; gain = 0.000
Writing XDEF routing.
Writing XDEF routing logical nets.
Writing XDEF routing special nets.
Wrote RouteStorage: Time (s): cpu = 00:00:00 ; elapsed = 00:00:00.019 . Memory (MB): peak = 1996.203 ; gain = 0.000
Wrote Netlist Cache: Time (s): cpu = 00:00:00 ; elapsed = 00:00:00.005 . Memory (MB): peak = 1996.203 ; gain = 0.000
Wrote Device Cache: Time (s): cpu = 00:00:00 ; elapsed = 00:00:00.006 . Memory (MB): peak = 1996.203 ; gain = 0.000
Write Physdb Complete: Time (s): cpu = 00:00:01 ; elapsed = 00:00:00.281 . Memory (MB): peak = 1996.203 ; gain = 0.000
INFO: [Common 17-1381] The checkpoint 'E:/FPGA/2024/MicroPhase-Z7-Lite-Board/BGN/edt_zc702/edt_zc702.runs/impl_1/system_wrapper_physopt.dcp' has been generated.
Command: route_design
Attempting to get a license for feature 'Implementation' and/or device 'xc7z020'
INFO: [Common 17-349] Got license for feature 'Implementation' and/or device 'xc7z020'


Starting Routing Task
INFO: [Route 35-254] Multithreading enabled for route_design using a maximum of 2 CPUs

Phase 1 Build RT Design
Checksum: PlaceDB: a1748a4a ConstDB: 0 ShapeSum: 31280ec7 RouteDB: 15f972f0
Post Restoration Checksum: NetGraph: 7f2b8031 | NumContArr: 848f227e | Constraints: c2a8fa9d | Timing: c2a8fa9d
Phase 1 Build RT Design | Checksum: 2890c97e9

Time (s): cpu = 00:00:15 ; elapsed = 00:00:14 . Memory (MB): peak = 2029.934 ; gain = 33.730

Phase 2 Router Initialization

Phase 2.1 Fix Topology Constraints
Phase 2.1 Fix Topology Constraints | Checksum: 2890c97e9

Time (s): cpu = 00:00:15 ; elapsed = 00:00:14 . Memory (MB): peak = 2029.934 ; gain = 33.730

Phase 2.2 Pre Route Cleanup
Phase 2.2 Pre Route Cleanup | Checksum: 2890c97e9

Time (s): cpu = 00:00:15 ; elapsed = 00:00:14 . Memory (MB): peak = 2029.934 ; gain = 33.730
 Number of Nodes with overlaps = 0

Phase 2.3 Update Timing
Phase 2.3 Update Timing | Checksum: 2656ce31e

Time (s): cpu = 00:00:16 ; elapsed = 00:00:15 . Memory (MB): peak = 2072.820 ; gain = 76.617
INFO: [Route 35-416] Intermediate Timing Summary | WNS=3.096  | TNS=0.000  | WHS=-0.211 | THS=-80.811|


Router Utilization Summary
  Global Vertical Routing Utilization    = 0 %
  Global Horizontal Routing Utilization  = 0 %
  Routable Net Status*
  *Does not include unroutable nets such as driverless and loadless.
  Run report_route_status for detailed report.
  Number of Failed Nets               = 5708
    (Failed Nets is the sum of unrouted and partially routed nets)
  Number of Unrouted Nets             = 5708
  Number of Partially Routed Nets     = 0
  Number of Node Overlaps             = 0

Phase 2 Router Initialization | Checksum: 2698c08ef

Time (s): cpu = 00:00:17 ; elapsed = 00:00:15 . Memory (MB): peak = 2087.539 ; gain = 91.336

Phase 3 Global Routing
Phase 3 Global Routing | Checksum: 2698c08ef

Time (s): cpu = 00:00:17 ; elapsed = 00:00:15 . Memory (MB): peak = 2087.539 ; gain = 91.336

Phase 4 Initial Routing

Phase 4.1 Initial Net Routing Pass
Phase 4.1 Initial Net Routing Pass | Checksum: 26c3fcfb2

Time (s): cpu = 00:00:17 ; elapsed = 00:00:16 . Memory (MB): peak = 2087.539 ; gain = 91.336
Phase 4 Initial Routing | Checksum: 26c3fcfb2

Time (s): cpu = 00:00:17 ; elapsed = 00:00:16 . Memory (MB): peak = 2087.539 ; gain = 91.336

Phase 5 Rip-up And Reroute

Phase 5.1 Global Iteration 0
 Number of Nodes with overlaps = 233
 Number of Nodes with overlaps = 6
 Number of Nodes with overlaps = 0
INFO: [Route 35-416] Intermediate Timing Summary | WNS=2.103  | TNS=0.000  | WHS=N/A    | THS=N/A    |

Phase 5.1 Global Iteration 0 | Checksum: 2b06a41eb

Time (s): cpu = 00:00:19 ; elapsed = 00:00:17 . Memory (MB): peak = 2087.539 ; gain = 91.336
Phase 5 Rip-up And Reroute | Checksum: 2b06a41eb

Time (s): cpu = 00:00:19 ; elapsed = 00:00:17 . Memory (MB): peak = 2087.539 ; gain = 91.336

Phase 6 Delay and Skew Optimization

Phase 6.1 Delay CleanUp
Phase 6.1 Delay CleanUp | Checksum: 2b06a41eb

Time (s): cpu = 00:00:19 ; elapsed = 00:00:17 . Memory (MB): peak = 2087.539 ; gain = 91.336

Phase 6.2 Clock Skew Optimization
Phase 6.2 Clock Skew Optimization | Checksum: 2b06a41eb

Time (s): cpu = 00:00:19 ; elapsed = 00:00:17 . Memory (MB): peak = 2087.539 ; gain = 91.336
Phase 6 Delay and Skew Optimization | Checksum: 2b06a41eb

Time (s): cpu = 00:00:19 ; elapsed = 00:00:17 . Memory (MB): peak = 2087.539 ; gain = 91.336

Phase 7 Post Hold Fix

Phase 7.1 Hold Fix Iter
INFO: [Route 35-416] Intermediate Timing Summary | WNS=2.199  | TNS=0.000  | WHS=0.057  | THS=0.000  |

Phase 7.1 Hold Fix Iter | Checksum: 251db8aaa

Time (s): cpu = 00:00:19 ; elapsed = 00:00:17 . Memory (MB): peak = 2087.539 ; gain = 91.336
Phase 7 Post Hold Fix | Checksum: 251db8aaa

Time (s): cpu = 00:00:19 ; elapsed = 00:00:17 . Memory (MB): peak = 2087.539 ; gain = 91.336

Phase 8 Route finalize

Router Utilization Summary
  Global Vertical Routing Utilization    = 0.787356 %
  Global Horizontal Routing Utilization  = 0.992901 %
  Routable Net Status*
  *Does not include unroutable nets such as driverless and loadless.
  Run report_route_status for detailed report.
  Number of Failed Nets               = 0
    (Failed Nets is the sum of unrouted and partially routed nets)
  Number of Unrouted Nets             = 0
  Number of Partially Routed Nets     = 0
  Number of Node Overlaps             = 0

Phase 8 Route finalize | Checksum: 251db8aaa

Time (s): cpu = 00:00:19 ; elapsed = 00:00:17 . Memory (MB): peak = 2087.539 ; gain = 91.336

Phase 9 Verifying routed nets

 Verification completed successfully
Phase 9 Verifying routed nets | Checksum: 251db8aaa

Time (s): cpu = 00:00:19 ; elapsed = 00:00:17 . Memory (MB): peak = 2087.539 ; gain = 91.336

Phase 10 Depositing Routes
Phase 10 Depositing Routes | Checksum: 26eb892ff

Time (s): cpu = 00:00:19 ; elapsed = 00:00:17 . Memory (MB): peak = 2087.539 ; gain = 91.336

Phase 11 Post Process Routing
Phase 11 Post Process Routing | Checksum: 26eb892ff

Time (s): cpu = 00:00:19 ; elapsed = 00:00:17 . Memory (MB): peak = 2087.539 ; gain = 91.336

Phase 12 Post Router Timing
INFO: [Route 35-57] Estimated Timing Summary | WNS=2.199  | TNS=0.000  | WHS=0.057  | THS=0.000  |

INFO: [Route 35-327] The final timing numbers are based on the router estimated timing analysis. For a complete and accurate timing signoff, please run report_timing_summary.
Phase 12 Post Router Timing | Checksum: 26eb892ff

Time (s): cpu = 00:00:19 ; elapsed = 00:00:17 . Memory (MB): peak = 2087.539 ; gain = 91.336
Total Elapsed time in route_design: 16.977 secs

Phase 13 Post-Route Event Processing
Phase 13 Post-Route Event Processing | Checksum: c9448dd1

Time (s): cpu = 00:00:19 ; elapsed = 00:00:17 . Memory (MB): peak = 2087.539 ; gain = 91.336
INFO: [Route 35-16] Router Completed Successfully
Ending Routing Task | Checksum: c9448dd1

Time (s): cpu = 00:00:19 ; elapsed = 00:00:17 . Memory (MB): peak = 2087.539 ; gain = 91.336

Routing Is Done.
INFO: [Common 17-83] Releasing license: Implementation
99 Infos, 1 Warnings, 0 Critical Warnings and 0 Errors encountered.
route_design completed successfully
route_design: Time (s): cpu = 00:00:19 ; elapsed = 00:00:17 . Memory (MB): peak = 2087.539 ; gain = 91.336
INFO: [Vivado 12-24828] Executing command : report_drc -file system_wrapper_drc_routed.rpt -pb system_wrapper_drc_routed.pb -rpx system_wrapper_drc_routed.rpx
Command: report_drc -file system_wrapper_drc_routed.rpt -pb system_wrapper_drc_routed.pb -rpx system_wrapper_drc_routed.rpx
INFO: [IP_Flow 19-1839] IP Catalog is up to date.
INFO: [DRC 23-27] Running DRC with 2 threads
INFO: [Vivado_Tcl 2-168] The results of DRC are in file E:/FPGA/2024/MicroPhase-Z7-Lite-Board/BGN/edt_zc702/edt_zc702.runs/impl_1/system_wrapper_drc_routed.rpt.
report_drc completed successfully
INFO: [Vivado 12-24828] Executing command : report_methodology -file system_wrapper_methodology_drc_routed.rpt -pb system_wrapper_methodology_drc_routed.pb -rpx system_wrapper_methodology_drc_routed.rpx
Command: report_methodology -file system_wrapper_methodology_drc_routed.rpt -pb system_wrapper_methodology_drc_routed.pb -rpx system_wrapper_methodology_drc_routed.rpx
INFO: [Timing 38-35] Done setting XDC timing constraints.
INFO: [DRC 23-133] Running Methodology with 2 threads
INFO: [Vivado_Tcl 2-1520] The results of Report Methodology are in file E:/FPGA/2024/MicroPhase-Z7-Lite-Board/BGN/edt_zc702/edt_zc702.runs/impl_1/system_wrapper_methodology_drc_routed.rpt.
report_methodology completed successfully
INFO: [Vivado 12-24828] Executing command : report_timing_summary -max_paths 10 -report_unconstrained -file system_wrapper_timing_summary_routed.rpt -pb system_wrapper_timing_summary_routed.pb -rpx system_wrapper_timing_summary_routed.rpx -warn_on_violation 
INFO: [Timing 38-35] Done setting XDC timing constraints.
INFO: [Timing 38-91] UpdateTimingParams: Speed grade: -2, Delay Type: min_max.
INFO: [Timing 38-191] Multithreading enabled for timing update using a maximum of 2 CPUs
INFO: [Vivado 12-24838] Running report commands "report_incremental_reuse, report_route_status" in parallel.
Running report generation with 2 threads.
INFO: [Vivado 12-24828] Executing command : report_incremental_reuse -file system_wrapper_incremental_reuse_routed.rpt
INFO: [Vivado_Tcl 4-1062] Incremental flow is disabled. No incremental reuse Info to report.
INFO: [Vivado 12-24828] Executing command : report_route_status -file system_wrapper_route_status.rpt -pb system_wrapper_route_status.pb
INFO: [Vivado 12-24828] Executing command : report_power -file system_wrapper_power_routed.rpt -pb system_wrapper_power_summary_routed.pb -rpx system_wrapper_power_routed.rpx
Command: report_power -file system_wrapper_power_routed.rpt -pb system_wrapper_power_summary_routed.pb -rpx system_wrapper_power_routed.rpx
Running Vector-less Activity Propagation...

Finished Running Vector-less Activity Propagation
116 Infos, 1 Warnings, 0 Critical Warnings and 0 Errors encountered.
report_power completed successfully
INFO: [Vivado 12-24828] Executing command : report_clock_utilization -file system_wrapper_clock_utilization_routed.rpt
INFO: [Vivado 12-24828] Executing command : report_bus_skew -warn_on_violation -file system_wrapper_bus_skew_routed.rpt -pb system_wrapper_bus_skew_routed.pb -rpx system_wrapper_bus_skew_routed.rpx
INFO: [Timing 38-91] UpdateTimingParams: Speed grade: -2, Delay Type: min_max.
INFO: [Timing 38-191] Multithreading enabled for timing update using a maximum of 2 CPUs
generate_parallel_reports: Time (s): cpu = 00:00:12 ; elapsed = 00:00:07 . Memory (MB): peak = 2146.543 ; gain = 59.004
INFO: [Timing 38-480] Writing timing data to binary archive.
Write ShapeDB Complete: Time (s): cpu = 00:00:00 ; elapsed = 00:00:00.013 . Memory (MB): peak = 2161.996 ; gain = 8.898
Wrote PlaceDB: Time (s): cpu = 00:00:00 ; elapsed = 00:00:00.247 . Memory (MB): peak = 2177.945 ; gain = 24.832
Wrote PulsedLatchDB: Time (s): cpu = 00:00:00 ; elapsed = 00:00:00 . Memory (MB): peak = 2177.945 ; gain = 0.000
Writing XDEF routing.
Writing XDEF routing logical nets.
Writing XDEF routing special nets.
Wrote RouteStorage: Time (s): cpu = 00:00:01 ; elapsed = 00:00:00.047 . Memory (MB): peak = 2177.945 ; gain = 0.000
Wrote Netlist Cache: Time (s): cpu = 00:00:00 ; elapsed = 00:00:00.004 . Memory (MB): peak = 2177.945 ; gain = 0.000
Wrote Device Cache: Time (s): cpu = 00:00:00 ; elapsed = 00:00:00.007 . Memory (MB): peak = 2177.945 ; gain = 0.000
Write Physdb Complete: Time (s): cpu = 00:00:01 ; elapsed = 00:00:00.309 . Memory (MB): peak = 2177.945 ; gain = 24.832
INFO: [Common 17-1381] The checkpoint 'E:/FPGA/2024/MicroPhase-Z7-Lite-Board/BGN/edt_zc702/edt_zc702.runs/impl_1/system_wrapper_routed.dcp' has been generated.
INFO: [Common 17-206] Exiting Vivado at Sun Feb 15 20:18:20 2026...

*** Running vivado
    with args -log system_wrapper.vdi -applog -m64 -product Vivado -messageDb vivado.pb -mode batch -source system_wrapper.tcl -notrace



****** Vivado v2024.2 (64-bit)
  **** SW Build 5239630 on Fri Nov 08 22:35:27 MST 2024
  **** IP Build 5239520 on Sun Nov 10 16:12:51 MST 2024
  **** SharedData Build 5239561 on Fri Nov 08 14:39:27 MST 2024
  **** Start of session at: Sun Feb 15 20:18:39 2026
    ** Copyright 1986-2022 Xilinx, Inc. All Rights Reserved.
    ** Copyright 2022-2024 Advanced Micro Devices, Inc. All Rights Reserved.

source system_wrapper.tcl -notrace
Command: open_checkpoint system_wrapper_routed.dcp
INFO: [Device 21-403] Loading part xc7z020clg400-2
Netlist sorting complete. Time (s): cpu = 00:00:00 ; elapsed = 00:00:00.113 . Memory (MB): peak = 699.645 ; gain = 0.000
INFO: [Netlist 29-17] Analyzing 493 Unisim elements for replacement
INFO: [Netlist 29-28] Unisim Transformation completed in 0 CPU seconds
INFO: [Project 1-479] Netlist was created with Vivado 2024.2
INFO: [Project 1-570] Preparing netlist for logic optimization
Read ShapeDB Complete: Time (s): cpu = 00:00:00 ; elapsed = 00:00:00.015 . Memory (MB): peak = 824.375 ; gain = 2.531
INFO: [Timing 38-478] Restoring timing data from binary archive.
INFO: [Timing 38-479] Binary timing data restore complete.
INFO: [Project 1-856] Restoring constraints from binary archive.
INFO: [Project 1-853] Binary constraint restore complete.
INFO: [Designutils 20-5722] Start Reading Physical Databases.
Reading placement.
Read Netlist Cache: Time (s): cpu = 00:00:00 ; elapsed = 00:00:00.004 . Memory (MB): peak = 1404.164 ; gain = 0.000
Reading placer database...
Read Device Cache: Time (s): cpu = 00:00:00 ; elapsed = 00:00:00.010 . Memory (MB): peak = 1404.164 ; gain = 0.000
Read PlaceDB: Time (s): cpu = 00:00:00 ; elapsed = 00:00:00.184 . Memory (MB): peak = 1404.164 ; gain = 0.000
Read PulsedLatchDB: Time (s): cpu = 00:00:00 ; elapsed = 00:00:00 . Memory (MB): peak = 1404.164 ; gain = 0.000
Reading routing.
Read RouteStorage: Time (s): cpu = 00:00:00 ; elapsed = 00:00:00.050 . Memory (MB): peak = 1404.164 ; gain = 0.000
Read Physdb Files: Time (s): cpu = 00:00:00 ; elapsed = 00:00:00.255 . Memory (MB): peak = 1404.164 ; gain = 0.000
Restored from archive | CPU: 0.000000 secs | Memory: 0.000000 MB |
Finished XDEF File Restore: Time (s): cpu = 00:00:00 ; elapsed = 00:00:00.288 . Memory (MB): peak = 1404.164 ; gain = 3.977
Netlist sorting complete. Time (s): cpu = 00:00:00 ; elapsed = 00:00:00.002 . Memory (MB): peak = 1404.164 ; gain = 0.000
INFO: [Project 1-111] Unisim Transformation Summary:
  A total of 34 instances were transformed.
  RAM128X1S => RAM128X1S (MUXF7, RAMS64E(x2)): 32 instances
  SRLC32E => SRL16E: 2 instances

INFO: [Project 1-604] Checkpoint was created with Vivado v2024.2 (64-bit) build 5239630
open_checkpoint: Time (s): cpu = 00:00:10 ; elapsed = 00:00:11 . Memory (MB): peak = 1404.324 ; gain = 1094.828
Command: write_bitstream -force system_wrapper.bit
Attempting to get a license for feature 'Implementation' and/or device 'xc7z020'
INFO: [Common 17-349] Got license for feature 'Implementation' and/or device 'xc7z020'
Running DRC as a precondition to command write_bitstream
INFO: [IP_Flow 19-234] Refreshing IP repositories
INFO: [IP_Flow 19-1704] No user IP repositories specified
INFO: [IP_Flow 19-2313] Loaded Vivado IP repository 'D:/Xilinx/Vivado/2024.2/data/ip'.
INFO: [DRC 23-27] Running DRC with 2 threads
INFO: [Vivado 12-3199] DRC finished with 0 Errors
INFO: [Vivado 12-3200] Please refer to the DRC report (report_drc) for more information.
INFO: [Designutils 20-2272] Running write_bitstream with 2 threads.
Loading data files...
Loading site data...
Loading route data...
Processing options...
Creating bitmap...
Creating bitstream...
Writing bitstream ./system_wrapper.bit...
INFO: [Vivado 12-1842] Bitgen Completed Successfully.
INFO: [Project 1-1876] WebTalk data collection is mandatory when using a ULT device. To see the specific WebTalk data collected for your design, open the usage_statistics_webtalk.html or usage_statistics_webtalk.xml file in the implementation directory.
INFO: [Common 17-83] Releasing license: Implementation
23 Infos, 0 Warnings, 0 Critical Warnings and 0 Errors encountered.
write_bitstream completed successfully
write_bitstream: Time (s): cpu = 00:00:14 ; elapsed = 00:00:11 . Memory (MB): peak = 2016.711 ; gain = 612.387
INFO: [Common 17-206] Exiting Vivado at Sun Feb 15 20:19:03 2026...
